{"id":"coach_carlo_ancelotti_profile","categoria":"coach","tipo":"fact","entrenador":"Carlo Ancelotti","entrenador_norm":"carlo ancelotti","season_year":null,"titulo":"Perfil historico de Carlo Ancelotti en la Champions League","clubes_mencionados":["Milan","Chelsea","Paris Saint Germain","Bayern Munich","Napoli","Real Madrid"],"datos_clave":{"partidos_dirigidos":191,"victorias":107,"empates":48,"derrotas":36,"champions_ganadas":4,"champions_ganadas_clubes":["Milan","Real Madrid"],"champions_ganadas_temporadas":["2002-03","2006-07","2013-14","2021-22"],"finalista_temporadas":["2004-05"],"subcampeon_temporadas":["2004-05"],"estilo_tags":["flexibilidad tactica","gestion del vestuario","momentos decisivos"],"aprox":false},"texto_index":"CATEGORIA: coach\nENTRENADOR: Carlo Ancelotti\nALIAS_BUSQUEDA: ancelotti | carlo ancelotti\nDATOS_CLAVE: partidos=191 | W=107 | D=48 | L=36 | UCL_titulos=4 | UCL_temporadas=2002-03, 2006-07, 2013-14, 2021-22 | FINALISTA=2004-05\nCLUBES: Milan | Chelsea | Paris Saint Germain | Bayern Munich | Napoli | Real Madrid\nCLAVES: entrenador | tecnico | mister | champions | ucl | palmares | titulos\n","texto":"Carlo Ancelotti es considerado el entrenador mas exitoso de la historia de la Champions League segun este dataset. Ha dirigido un total de 191 partidos en la competicion, repartidos entre Milan, Chelsea, Paris Saint Germain, Bayern Munich, Napoli y Real Madrid. Sus cifras globales son 107 victorias, 48 empates y 36 derrotas en Champions. En cuanto a titulos, Ancelotti ha ganado cuatro Champions League como entrenador: dos con el Milan y dos con el Real Madrid. Con el Milan fue campeon en la temporada 2002-03 y en la temporada 2006-07. Con el Real Madrid gano la Champions en la temporada 2013-14 y en la temporada 2021-22. Tambien fue finalista con el Milan en la temporada 2004-05. Su estilo se basa en la flexibilidad tactica, la gestion del vestuario y la capacidad para sacar el maximo rendimiento de los jugadores en los momentos decisivos."}
{"id":"coach_pep_guardiola_profile","categoria":"coach","tipo":"fact","entrenador":"Pep Guardiola","entrenador_norm":"pep guardiola","season_year":null,"titulo":"Perfil historico de Pep Guardiola en la Champions League","clubes_mencionados":["Barcelona","Bayern Munich","Manchester City"],"datos_clave":{"partidos_dirigidos":167,"victorias":103,"empates":34,"derrotas":30,"champions_ganadas":3,"champions_ganadas_clubes":["Barcelona","Manchester City"],"champions_ganadas_temporadas":["2008-09","2010-11","2022-23"],"subcampeon_temporadas":["2020-21"],"finalista_temporadas":["2020-21"],"estilo_tags":["juego de posicion","posesion","presion tras perdida","superioridades numericas"],"aprox":false},"texto_index":"CATEGORIA: coach\nENTRENADOR: Pep Guardiola\nALIAS_BUSQUEDA: guardiola | pep guardiola\nDATOS_CLAVE: partidos=167 | W=103 | D=34 | L=30 | UCL_titulos=3 | UCL_temporadas=2008-09, 2010-11, 2022-23 | SUBCAMPEON=2020-21\nCLUBES: Barcelona | Bayern Munich | Manchester City\nCLAVES: entrenador | tecnico | mister | champions | ucl | juego de posicion | posesion\n","texto":"Pep Guardiola es uno de los entrenadores mas influyentes del futbol moderno y una referencia del juego de posicion. En este dataset ha dirigido 167 partidos de Champions League con tres equipos: Barcelona, Bayern Munich y Manchester City. Sus numeros globales son 103 victorias, 34 empates y 30 derrotas en la competicion. Guardiola ha ganado tres Champions League como entrenador: dos con el Barcelona y una con el Manchester City. Con el Barcelona fue campeon en la temporada 2008-09 y en la temporada 2010-11. Mas adelante, con el Manchester City, gano la Champions en la temporada 2022-23. Tambien fue subcampeon con el City en la temporada 2020-21. Su estilo se basa en la posesion dominante del balon, la presion tras perdida, las estructuras flexibles y la creacion constante de superioridades numericas en todas las zonas del campo."}
{"id":"coach_zinedine_zidane_profile","categoria":"coach","tipo":"fact","entrenador":"Zinedine Zidane","entrenador_norm":"zinedine zidane","season_year":null,"titulo":"Perfil historico de Zinedine Zidane en la Champions League","clubes_mencionados":["Real Madrid"],"datos_clave":{"partidos_dirigidos":49,"victorias":31,"empates":11,"derrotas":7,"champions_ganadas":3,"champions_ganadas_clubes":["Real Madrid"],"champions_ganadas_temporadas":["2015-16","2016-17","2017-18"],"subcampeon_temporadas":[],"finalista_temporadas":[],"estilo_tags":["pragmatico","gestion emocional","adaptacion al rival","jerarquia vestuario"],"aprox":false},"texto_index":"CATEGORIA: coach\nENTRENADOR: Zinedine Zidane\nALIAS_BUSQUEDA: zidane | zinedine zidane\nDATOS_CLAVE: partidos=49 | W=31 | D=11 | L=7 | UCL_titulos=3 | UCL_temporadas=2015-16, 2016-17, 2017-18\nCLUBES: Real Madrid\nCLAVES: entrenador | tecnico | mister | champions | ucl | tres consecutivas\n","texto":"Zinedine Zidane es el unico entrenador que ha ganado tres Champions League consecutivas segun este dataset. Dirigio al Real Madrid en la Champions entre 2016 y 2021, acumulando 49 partidos en la competicion. Sus cifras son 31 victorias, 11 empates y 7 derrotas. Como entrenador, Zidane gano tres Champions seguidas con el Real Madrid: fue campeon en la temporada 2015-16, en la temporada 2016-17 y en la temporada 2017-18. Este triplete constituye uno de los mayores ciclos ganadores de la era moderna de la Champions. Su estilo es pragmatico y se apoya en la jerarquia del vestuario, la gestion emocional de los partidos y la adaptacion al rival, potenciando al maximo a figuras como Cristiano Ronaldo, Benzema, Modric o Sergio Ramos."}
{"id":"coach_alex_ferguson_profile","categoria":"coach","tipo":"fact","entrenador":"Alex Ferguson","entrenador_norm":"alex ferguson","season_year":null,"titulo":"Perfil historico de Sir Alex Ferguson en la Champions League","clubes_mencionados":["Manchester United"],"datos_clave":{"partidos_dirigidos":190,"victorias":102,"empates":49,"derrotas":39,"champions_ganadas":2,"champions_ganadas_clubes":["Manchester United"],"champions_ganadas_temporadas":["1998-99","2007-08"],"subcampeon_temporadas":["2008-09","2010-11"],"finalista_temporadas":["2008-09","2010-11"],"estilo_tags":["verticalidad","extremos rapidos","mentalidad ofensiva","reconstruccion de equipos"],"aprox":false},"texto_index":"CATEGORIA: coach\nENTRENADOR: Sir Alex Ferguson\nALIAS_BUSQUEDA: ferguson | alex ferguson | sir alex ferguson\nDATOS_CLAVE: partidos=190 | W=102 | D=49 | L=39 | UCL_titulos=2 | UCL_temporadas=1998-99, 2007-08 | SUBCAMPEON=2008-09, 2010-11\nCLUBES: Manchester United\nCLAVES: entrenador | tecnico | mister | champions | ucl\n","texto":"Sir Alex Ferguson es el entrenador con mas años consecutivos dirigiendo en la Champions League moderna. En este dataset, entreno al Manchester United en la competicion entre 1993 y 2013. En total dirigio 190 partidos de Champions, con un balance de 102 victorias, 49 empates y 39 derrotas. Ferguson gano dos Champions League con el Manchester United: fue campeon en la temporada 1998-99, famosa por la remontada ante el Bayern en la final, y en la temporada 2007-08, cuando el United vencio al Chelsea. Ademas, fue subcampeon en la temporada 2008-09 y en la temporada 2010-11. Su estilo combinaba verticalidad, uso de extremos rapidos, mentalidad ofensiva y una enorme capacidad para reconstruir equipos competitivos a lo largo de los años."}
{"id":"coach_jose_mourinho_profile","categoria":"coach","tipo":"fact","entrenador":"Jose Mourinho","entrenador_norm":"jose mourinho","season_year":null,"titulo":"Perfil historico de Jose Mourinho en la Champions League","clubes_mencionados":["Porto","Chelsea","Inter","Real Madrid","Manchester United","Roma"],"datos_clave":{"partidos_dirigidos":151,"victorias":82,"empates":39,"derrotas":30,"champions_ganadas":2,"champions_ganadas_clubes":["Porto","Inter"],"champions_ganadas_temporadas":["2003-04","2009-10"],"subcampeon_temporadas":[],"finalista_temporadas":[],"semifinalista_temporadas":["2010-11","2011-12","2012-13"],"estilo_tags":["bloque defensivo compacto","transiciones rapidas","preparacion tactica","plan de partido"],"aprox":false},"texto_index":"CATEGORIA: coach\nENTRENADOR: Jose Mourinho\nALIAS_BUSQUEDA: mourinho | jose mourinho\nDATOS_CLAVE: partidos=151 | W=82 | D=39 | L=30 | UCL_titulos=2 | UCL_temporadas=2003-04, 2009-10 | SEMIFINALES=2010-11, 2011-12, 2012-13\nCLUBES: Porto | Chelsea | Inter | Real Madrid | Manchester United | Roma\nCLAVES: entrenador | tecnico | mister | champions | ucl | eliminatorias\n","texto":"Jose Mourinho es uno de los entrenadores mas estrategicos y reconocibles de la Champions League. En este dataset ha dirigido 151 partidos en la competicion con seis equipos distintos: Porto, Chelsea, Inter, Real Madrid, Manchester United y Roma. Sus cifras globales son 82 victorias, 39 empates y 30 derrotas. Mourinho ha ganado dos Champions League como entrenador y lo ha hecho con dos clubes diferentes. Primero se corono campeon con el Porto en la temporada 2003-04. Posteriormente gano la Champions con el Inter de Milan en la temporada 2009-10, logrando el triplete (liga, copa y Champions). Tambien llevo al Real Madrid a tres semifinales consecutivas (2010-11, 2011-12 y 2012-13). Su estilo se basa en un bloque defensivo compacto, transiciones rapidas y una preparacion psicologica y tactica muy detallada de cada eliminatoria."}
{"id":"coach_jupp_heynckes_profile","categoria":"coach","tipo":"fact","entrenador":"Jupp Heynckes","entrenador_norm":"jupp heynckes","season_year":null,"titulo":"Perfil historico de Jupp Heynckes en la Champions League","clubes_mencionados":["Real Madrid","Benfica","Athletic Club","Bayern Munich"],"datos_clave":{"partidos_dirigidos":69,"victorias":41,"empates":14,"derrotas":14,"champions_ganadas":2,"champions_ganadas_clubes":["Real Madrid","Bayern Munich"],"champions_ganadas_temporadas":["1997-98","2012-13"],"subcampeon_temporadas":[],"finalista_temporadas":[],"estilo_tags":["equilibrio defensa-ataque","amplitud ofensiva","dominio fisico"],"aprox":false},"texto_index":"CATEGORIA: coach\nENTRENADOR: Jupp Heynckes\nALIAS_BUSQUEDA: heynckes | jupp heynckes\nDATOS_CLAVE: partidos=69 | W=41 | D=14 | L=14 | UCL_titulos=2 | UCL_temporadas=1997-98, 2012-13\nCLUBES: Real Madrid | Benfica | Athletic Club | Bayern Munich\nCLAVES: entrenador | tecnico | mister | champions | ucl\n","texto":"Jupp Heynckes es uno de los pocos entrenadores que han ganado la Champions League con dos clubes diferentes. En este dataset aparece con 69 partidos dirigidos en la competicion, al frente de Real Madrid, Benfica, Athletic Club y Bayern Munich. Su balance es de 41 victorias, 14 empates y 14 derrotas. Gano la Champions con el Real Madrid en la temporada 1997-98, rompiendo la sequia europea del club blanco. Años mas tarde, conquisto de nuevo el titulo con el Bayern Munich en la temporada 2012-13, firmando un triplete historico. Sus equipos se caracterizaron por el equilibrio entre defensa y ataque, la amplitud ofensiva y un gran dominio fisico del partido."}
{"id":"coach_vicente_del_bosque_profile","categoria":"coach","tipo":"fact","entrenador":"Vicente del Bosque","entrenador_norm":"vicente del bosque","season_year":null,"titulo":"Perfil historico de Vicente del Bosque en Champions League","clubes_mencionados":["Real Madrid"],"datos_clave":{"partidos_dirigidos":41,"victorias":24,"empates":9,"derrotas":8,"champions_ganadas":2,"champions_ganadas_clubes":["Real Madrid"],"champions_ganadas_temporadas":["1999-2000","2001-02"],"subcampeon_temporadas":[],"finalista_temporadas":[],"estilo_tags":["estabilidad","gestion tranquila","libertad creativa"],"aprox":false},"texto_index":"CATEGORIA: coach\nENTRENADOR: Vicente del Bosque\nALIAS_BUSQUEDA: del bosque | vicente del bosque\nDATOS_CLAVE: partidos=41 | W=24 | D=9 | L=8 | UCL_titulos=2 | UCL_temporadas=1999-2000, 2001-02\nCLUBES: Real Madrid\nCLAVES: entrenador | tecnico | mister | champions | ucl\n","texto":"Vicente del Bosque fue el entrenador del Real Madrid en una de sus etapas mas estables en la Champions League moderna. En este dataset dirigio 41 partidos de Champions con el club blanco. Sus numeros son 24 victorias, 9 empates y 8 derrotas. Del Bosque gano dos Champions League con el Real Madrid: la primera en la temporada 1999-2000, en la final frente al Valencia, y la segunda en la temporada 2001-02, en la final ante el Bayer Leverkusen, decidida por la iconica volea de Zidane. Su estilo se basaba en la estabilidad, la gestion tranquila del vestuario y la libertad para que los jugadores creativos se expresaran en ataque."}
{"id":"coach_jurgen_klopp_profile","categoria":"coach","tipo":"fact","entrenador":"Jurgen Klopp","entrenador_norm":"jurgen klopp","season_year":null,"titulo":"Perfil historico de Jurgen Klopp en la Champions League","clubes_mencionados":["Borussia Dortmund","Liverpool"],"datos_clave":{"partidos_dirigidos":100,"victorias":58,"empates":21,"derrotas":21,"champions_ganadas":1,"champions_ganadas_clubes":["Liverpool"],"champions_ganadas_temporadas":["2018-19"],"subcampeon_temporadas":["2012-13","2017-18"],"finalista_temporadas":["2012-13","2017-18","2018-19"],"estilo_tags":["presion alta","transiciones","intensidad","ritmo alto"],"aprox":false},"texto_index":"CATEGORIA: coach\nENTRENADOR: Jurgen Klopp\nALIAS_BUSQUEDA: klopp | jurgen klopp\nDATOS_CLAVE: partidos=100 | W=58 | D=21 | L=21 | UCL_titulos=1 | UCL_temporadas=2018-19 | SUBCAMPEON=2012-13, 2017-18\nCLUBES: Borussia Dortmund | Liverpool\nCLAVES: entrenador | tecnico | mister | champions | ucl | gegenpressing\n","texto":"Jurgen Klopp es uno de los entrenadores mas reconocibles de la era moderna por su estilo basado en la presion alta y las transiciones intensas. En este dataset ha dirigido 100 partidos de Champions League con dos equipos: Borussia Dortmund y Liverpool. Sus cifras globales son 58 victorias, 21 empates y 21 derrotas. Klopp ha disputado tres finales de Champions: fue subcampeon con el Borussia Dortmund en la temporada 2012-13, subcampeon con el Liverpool en la temporada 2017-18 y campeon con el Liverpool en la temporada 2018-19. Es decir, ha ganado una Champions League como entrenador, la de 2018-19 con el Liverpool. Sus equipos destacan por el ritmo alto, la intensidad sin balon y la capacidad de generar ocasiones a partir de la presion."}
{"id":"coach_thomas_tuchel_profile","categoria":"coach","tipo":"fact","entrenador":"Thomas Tuchel","entrenador_norm":"thomas tuchel","season_year":null,"titulo":"Perfil historico de Thomas Tuchel en la Champions League","clubes_mencionados":["Borussia Dortmund","Paris Saint Germain","Chelsea","Bayern Munich"],"datos_clave":{"partidos_dirigidos":73,"victorias":40,"empates":16,"derrotas":17,"champions_ganadas":1,"champions_ganadas_clubes":["Chelsea"],"champions_ganadas_temporadas":["2020-21"],"subcampeon_temporadas":["2019-20"],"finalista_temporadas":["2019-20","2020-21"],"estilo_tags":["organizacion defensiva","ajustes tacticos","adaptacion al rival","eliminatorias"],"aprox":false},"texto_index":"CATEGORIA: coach\nENTRENADOR: Thomas Tuchel\nALIAS_BUSQUEDA: tuchel | thomas tuchel\nDATOS_CLAVE: partidos=73 | W=40 | D=16 | L=17 | UCL_titulos=1 | UCL_temporadas=2020-21 | SUBCAMPEON=2019-20\nCLUBES: Borussia Dortmund | Paris Saint Germain | Chelsea | Bayern Munich\nCLAVES: entrenador | tecnico | mister | champions | ucl\n","texto":"Thomas Tuchel es un entrenador analitico y muy flexible en el plano tactico. En este dataset ha dirigido 73 partidos de Champions League con Borussia Dortmund, Paris Saint Germain, Chelsea y Bayern Munich. Su balance total es de 40 victorias, 16 empates y 17 derrotas. Tuchel ha disputado dos finales de Champions: fue subcampeon con el Paris Saint Germain en la temporada 2019-20 y campeon con el Chelsea en la temporada 2020-21. Por tanto, ha ganado una Champions League como entrenador, la de 2020-21 con el Chelsea, en una ruta en la que su equipo elimino a Atletico de Madrid, Real Madrid y Manchester City. Sus equipos destacan por la organizacion defensiva, los ajustes tacticos y la capacidad para adaptarse al rival en eliminatorias."}
{"id":"coach_johan_cruyff_profile","categoria":"coach","tipo":"fact","entrenador":"Johan Cruyff","entrenador_norm":"johan cruyff","season_year":null,"titulo":"Perfil historico de Johan Cruyff como entrenador","clubes_mencionados":["Barcelona"],"datos_clave":{"partidos_dirigidos":52,"victorias":25,"empates":14,"derrotas":13,"champions_ganadas":1,"champions_ganadas_clubes":["Barcelona"],"champions_ganadas_temporadas":["1991-92"],"nota_formato":"Copa de Europa/Champions (segun texto)","subcampeon_temporadas":[],"finalista_temporadas":[],"estilo_tags":["juego de posicion","defensa adelantada","centrocampistas creativos"],"aprox":false},"texto_index":"CATEGORIA: coach\nENTRENADOR: Johan Cruyff\nALIAS_BUSQUEDA: cruyff | johan cruyff\nDATOS_CLAVE: partidos=52 | W=25 | D=14 | L=13 | UCL_titulos=1 | UCL_temporadas=1991-92\nCLUBES: Barcelona\nCLAVES: entrenador | tecnico | mister | champions | ucl | copa de europa\n","texto":"Johan Cruyff fue el creador de la idea de juego que mas tarde perfeccionaria el Barcelona de Guardiola. En este dataset se recoge su etapa como entrenador del Barcelona en competiciones europeas. Cruyff dirigio 52 partidos europeos con el club azulgrana entre finales de los años ochenta y mediados de los noventa, con 25 victorias, 14 empates y 13 derrotas. En el contexto de este trabajo se considera que gano una Copa de Europa/Champions con el Barcelona en la temporada 1991-92. Aunque solo obtuvo un titulo, su influencia tactica es enorme: aposto por el juego de posicion, la defensa adelantada y el protagonismo de centrocampistas creativos, sentando las bases del estilo que domino la Champions en años posteriores."}
{"id":"coach_rafa_benitez_profile","categoria":"coach","tipo":"fact","entrenador":"Rafael Benitez","entrenador_norm":"rafael benitez","season_year":null,"titulo":"Perfil historico de Rafael Benitez en la Champions League","clubes_mencionados":["Valencia","Liverpool","Inter","Napoli"],"datos_clave":{"partidos_dirigidos":70,"victorias":34,"empates":18,"derrotas":18,"champions_ganadas":1,"champions_ganadas_clubes":["Liverpool"],"champions_ganadas_temporadas":["2004-05"],"subcampeon_temporadas":["2006-07"],"finalista_temporadas":["2004-05","2006-07"],"estilo_tags":["solidez defensiva","orden tactico","analisis","preparacion de eliminatorias"],"aprox":false},"texto_index":"CATEGORIA: coach\nENTRENADOR: Rafael Benitez\nALIAS_BUSQUEDA: benitez | rafael benitez\nDATOS_CLAVE: partidos=70 | W=34 | D=18 | L=18 | UCL_titulos=1 | UCL_temporadas=2004-05 | SUBCAMPEON=2006-07\nCLUBES: Valencia | Liverpool | Inter | Napoli\nCLAVES: entrenador | tecnico | mister | champions | ucl\n","texto":"Rafael Benitez es conocido como uno de los grandes analistas tacticos del futbol europeo. En este dataset ha dirigido 70 partidos de Champions League con Valencia, Liverpool, Inter y Napoli. Sus numeros globales son 34 victorias, 18 empates y 18 derrotas. Benitez gano una Champions League como entrenador con el Liverpool en la temporada 2004-05, en la famosa final de Estambul, donde su equipo remonto un 3-0 ante el Milan. Ademas, fue subcampeon en la temporada 2006-07, tambien con el Liverpool. Sus equipos se caracterizan por la solidez defensiva, el orden tactico y la preparacion muy detallada de cada partido y de cada eliminatoria."}
{"id":"coach_diego_simeone_profile","categoria":"coach","tipo":"fact","entrenador":"Diego Simeone","entrenador_norm":"diego simeone","season_year":null,"titulo":"Perfil historico de Diego Simeone en la Champions League","clubes_mencionados":["Atletico de Madrid","Bayern Munich","Barcelona","Liverpool","Real Madrid"],"datos_clave":{"partidos_dirigidos":82,"victorias":45,"empates":20,"derrotas":17,"champions_ganadas":0,"champions_ganadas_clubes":[],"champions_ganadas_temporadas":[],"subcampeon_temporadas":["2013-14","2015-16"],"finalista_temporadas":["2013-14","2015-16"],"semifinalista_temporadas":["2016-17"],"estilo_tags":["defensa organizada","intensidad","transiciones"],"aprox":false},"texto_index":"CATEGORIA: coach\nENTRENADOR: Diego Simeone\nALIAS_BUSQUEDA: simeone | diego simeone\nDATOS_CLAVE: partidos=82 | W=45 | D=20 | L=17 | UCL_titulos=0 | SUBCAMPEON=2013-14, 2015-16 | SEMIFINAL=2016-17\nCLUBES: Atletico de Madrid\nCLAVES: entrenador | tecnico | mister | champions | ucl\n","texto":"Diego Simeone es uno de los entrenadores mas competitivos de la Champions moderna. En este dataset aparece como entrenador del Atletico de Madrid, equipo al que ha dirigido en 82 partidos de Champions League. Sus cifras son 45 victorias, 20 empates y 17 derrotas. Aunque Simeone no ha ganado la Champions, ha disputado dos finales con el Atletico de Madrid: fue subcampeon en la temporada 2013-14 y en la temporada 2015-16, en ambas ocasiones frente al Real Madrid y en partidos decididos en los minutos finales o en la tanda de penaltis. Tambien ha llegado a semifinales en la temporada 2016-17 y ha eliminado a rivales de primer nivel como Bayern Munich, Barcelona o Liverpool. Su estilo se basa en la defensa organizada, la intensidad y las transiciones."}
{"id":"coach_fabio_capello_profile","categoria":"coach","tipo":"fact","entrenador":"Fabio Capello","entrenador_norm":"fabio capello","season_year":null,"titulo":"Perfil historico de Fabio Capello en la Champions League","clubes_mencionados":["Milan","Real Madrid","Roma","Juventus"],"datos_clave":{"partidos_dirigidos":86,"victorias":43,"empates":25,"derrotas":18,"champions_ganadas":1,"champions_ganadas_clubes":["Milan"],"champions_ganadas_temporadas":["1993-94"],"subcampeon_temporadas":[],"finalista_temporadas":[],"estilo_tags":["organizacion defensiva","presion intensa","transiciones rapidas"],"aprox":true},"texto_index":"CATEGORIA: coach\nENTRENADOR: Fabio Capello\nALIAS_BUSQUEDA: capello | fabio capello\nDATOS_CLAVE: partidos~=86 | W=43 | D=25 | L=18 | UCL_titulos=1 | UCL_temporadas=1993-94\nCLUBES: Milan | Real Madrid | Roma | Juventus\nCLAVES: entrenador | tecnico | mister | champions | ucl\n","texto":"Fabio Capello fue el tecnico del Milan en una de las etapas mas dominantes del futbol europeo. En la Champions moderna se le recuerda sobre todo por la final de la temporada 1993-94, cuando su Milan gano 4-0 al Barcelona en Atenas. En este dataset se le atribuyen aproximadamente 86 partidos dirigidos en Champions, con 43 victorias, 25 empates y 18 derrotas, al frente de equipos como Milan, Real Madrid, Roma y Juventus. Capello gano una Champions League como entrenador del Milan en la temporada 1993-94. Sus equipos se caracterizaban por una gran organizacion defensiva, una presion intensa y transiciones ofensivas rapidas, combinando solidez atras y pegada arriba."}
{"id":"coach_louis_van_gaal_profile","categoria":"coach","tipo":"fact","entrenador":"Louis van Gaal","entrenador_norm":"louis van gaal","season_year":null,"titulo":"Perfil historico de Louis van Gaal en la Champions League","clubes_mencionados":["Ajax","Barcelona","Bayern Munich","AZ"],"datos_clave":{"partidos_dirigidos":80,"victorias":40,"empates":24,"derrotas":16,"champions_ganadas":1,"champions_ganadas_clubes":["Ajax"],"champions_ganadas_temporadas":["1994-95"],"subcampeon_temporadas":["1995-96"],"finalista_temporadas":["1994-95","1995-96"],"estilo_tags":["presion alta","salida de balon","rotacion de posiciones"],"aprox":true},"texto_index":"CATEGORIA: coach\nENTRENADOR: Louis van Gaal\nALIAS_BUSQUEDA: van gaal | louis van gaal\nDATOS_CLAVE: partidos~=80 | W=40 | D=24 | L=16 | UCL_titulos=1 | UCL_temporadas=1994-95 | SUBCAMPEON=1995-96\nCLUBES: Ajax | Barcelona | Bayern Munich | AZ\nCLAVES: entrenador | tecnico | mister | champions | ucl\n","texto":"Louis van Gaal fue el arquitecto del Ajax campeon de Europa en la mitad de los años noventa. En este dataset se recogen alrededor de 80 partidos dirigidos por Van Gaal en la Champions League con equipos como Ajax, Barcelona, Bayern Munich y AZ, con 40 victorias, 24 empates y 16 derrotas. Su mayor exito fue la Champions que gano con el Ajax en la temporada 1994-95, con un equipo muy joven que practico un futbol de presion alta, salida de balon desde atras y rotacion constante de posiciones. Tambien llego a la final con el Ajax en la temporada 1995-96. El Ajax de Van Gaal es una referencia tactica clave para muchos entrenadores posteriores."}
{"id":"coach_ottmar_hitzfeld_profile","categoria":"coach","tipo":"fact","entrenador":"Ottmar Hitzfeld","entrenador_norm":"ottmar hitzfeld","season_year":null,"titulo":"Perfil historico de Ottmar Hitzfeld en la Champions League","clubes_mencionados":["Borussia Dortmund","Bayern Munich"],"datos_clave":{"partidos_dirigidos":87,"victorias":45,"empates":23,"derrotas":19,"champions_ganadas":2,"champions_ganadas_clubes":["Borussia Dortmund","Bayern Munich"],"champions_ganadas_temporadas":["1996-97","2000-01"],"subcampeon_temporadas":[],"finalista_temporadas":[],"estilo_tags":["solidez defensiva","potencia fisica","balon parado","ataque directo"],"aprox":true},"texto_index":"CATEGORIA: coach\nENTRENADOR: Ottmar Hitzfeld\nALIAS_BUSQUEDA: hitzfeld | ottmar hitzfeld\nDATOS_CLAVE: partidos~=87 | W~=45 | D~=23 | L~=19 | UCL_titulos=2 | UCL_temporadas=1996-97, 2000-01\nCLUBES: Borussia Dortmund | Bayern Munich\nCLAVES: entrenador | tecnico | mister | champions | ucl\n","texto":"Ottmar Hitzfeld es uno de los pocos entrenadores que han ganado la Champions League con dos clubes diferentes. En este dataset se le atribuyen 87 partidos en la competicion, dirigidos principalmente con Borussia Dortmund y Bayern Munich, con un balance aproximado de 45 victorias, 23 empates y 19 derrotas. Hitzfeld gano la Champions con el Borussia Dortmund en la temporada 1996-97 y volvio a levantar el trofeo con el Bayern Munich en la temporada 2000-01. Sus equipos se caracterizaban por la solidez defensiva, la potencia fisica, la eficacia a balon parado y ataques directos bien trabajados."}
{"id":"coach_frank_rijkaard_profile","categoria":"coach","tipo":"fact","entrenador":"Frank Rijkaard","entrenador_norm":"frank rijkaard","season_year":null,"titulo":"Perfil historico de Frank Rijkaard en la Champions League","clubes_mencionados":["Barcelona","Arsenal"],"datos_clave":{"partidos_dirigidos":45,"victorias":23,"empates":12,"derrotas":10,"champions_ganadas":1,"champions_ganadas_clubes":["Barcelona"],"champions_ganadas_temporadas":["2005-06"],"subcampeon_temporadas":[],"finalista_temporadas":["2005-06"],"estilo_tags":["posesion","amplitud ofensiva","agresividad tras perdida"],"aprox":true},"texto_index":"CATEGORIA: coach\nENTRENADOR: Frank Rijkaard\nALIAS_BUSQUEDA: rijkaard | frank rijkaard\nDATOS_CLAVE: partidos~=45 | W=23 | D=12 | L=10 | UCL_titulos=1 | UCL_temporadas=2005-06\nCLUBES: Barcelona\nCLAVES: entrenador | tecnico | mister | champions | ucl\n","texto":"Frank Rijkaard fue el entrenador que devolvio al Barcelona a la cima de Europa en la mitad de la decada de 2000. En este dataset se recoge que dirigio alrededor de 45 partidos de Champions League con el Barcelona, con 23 victorias, 12 empates y 10 derrotas. Su mayor logro fue la Champions que gano en la temporada 2005-06, en la final frente al Arsenal, con un equipo liderado por Ronaldinho, Eto'o y un joven Lionel Messi. El Barcelona de Rijkaard combino posesion de balon, amplitud ofensiva y agresividad tras perdida, sentando las bases del estilo que luego perfeccionaria Guardiola. En resumen, Rijkaard gano una Champions League como entrenador, la de 2005-06 con el Barcelona."}
{"id":"coach_roberto_di_matteo_profile","categoria":"coach","tipo":"fact","entrenador":"Roberto Di Matteo","entrenador_norm":"roberto di matteo","season_year":null,"titulo":"Perfil historico de Roberto Di Matteo en la Champions League","clubes_mencionados":["Chelsea","Schalke 04","Napoli","Barcelona","Bayern Munich"],"datos_clave":{"partidos_dirigidos":20,"victorias":10,"empates":5,"derrotas":5,"champions_ganadas":1,"champions_ganadas_clubes":["Chelsea"],"champions_ganadas_temporadas":["2011-12"],"subcampeon_temporadas":[],"finalista_temporadas":["2011-12"],"estilo_tags":["solidez","resistencia","tecnico interino"],"aprox":true},"texto_index":"CATEGORIA: coach\nENTRENADOR: Roberto Di Matteo\nALIAS_BUSQUEDA: di matteo | roberto di matteo\nDATOS_CLAVE: partidos~=20 | W=10 | D=5 | L=5 | UCL_titulos=1 | UCL_temporadas=2011-12\nCLUBES: Chelsea | Schalke 04\nCLAVES: entrenador | tecnico | mister | champions | ucl\n","texto":"Roberto Di Matteo es recordado por su breve pero historica etapa como entrenador del Chelsea en la Champions League. En este dataset aparece con unos 20 partidos dirigidos en la competicion, entre Chelsea y Schalke 04, con 10 victorias, 5 empates y 5 derrotas. Su gran logro fue la Champions que gano con el Chelsea en la temporada 2011-12. Tomo al equipo a mitad de temporada y, con un planteamiento muy solido y resistente, elimino a rivales como Napoli, Barcelona y Bayern Munich antes de ganar la final en la tanda de penaltis. Di Matteo gano por tanto una Champions League como entrenador, la de 2011-12 con el Chelsea, y es un ejemplo de tecnico interino que logra el maximo exito continental."}
{"id":"coach_hansi_flick_profile","categoria":"coach","tipo":"fact","entrenador":"Hansi Flick","entrenador_norm":"hansi flick","season_year":null,"titulo":"Perfil historico de Hansi Flick en la Champions League","clubes_mencionados":["Bayern Munich"],"datos_clave":{"partidos_dirigidos":26,"victorias":21,"empates":3,"derrotas":2,"champions_ganadas":1,"champions_ganadas_clubes":["Bayern Munich"],"champions_ganadas_temporadas":["2019-20"],"subcampeon_temporadas":[],"finalista_temporadas":["2019-20"],"estilo_tags":["presion alta","linea defensiva adelantada","ritmo ofensivo alto"],"aprox":false},"texto_index":"CATEGORIA: coach\nENTRENADOR: Hansi Flick\nALIAS_BUSQUEDA: flick | hansi flick\nDATOS_CLAVE: partidos=26 | W=21 | D=3 | L=2 | UCL_titulos=1 | UCL_temporadas=2019-20\nCLUBES: Bayern Munich\nCLAVES: entrenador | tecnico | mister | champions | ucl\n","texto":"Hansi Flick protagonizo una de las campañas mas dominantes de la historia reciente de la Champions League con el Bayern Munich. En este dataset figura con 26 partidos dirigidos en la competicion, todos ellos con el Bayern, con 21 victorias, 3 empates y solo 2 derrotas. Flick gano la Champions en la temporada 2019-20, completando un torneo perfecto en cuanto a resultados. Su equipo se caracterizo por una presion muy alta, una linea defensiva adelantada, un ritmo ofensivo muy elevado y jugadores clave como Lewandowski, Muller, Gnabry o Davies. Hansi Flick ha ganado, segun estos datos, una Champions League como entrenador, la de 2019-20 con el Bayern Munich."}
{"id":"coach_luis_enrique_profile","categoria":"coach","tipo":"fact","entrenador":"Luis Enrique","entrenador_norm":"luis enrique","season_year":null,"titulo":"Perfil historico de Luis Enrique en la Champions League","clubes_mencionados":["Barcelona","Paris Saint Germain"],"datos_clave":{"partidos_dirigidos":60,"victorias":35,"empates":12,"derrotas":13,"champions_ganadas":2,"champions_ganadas_clubes":["Barcelona","Paris Saint Germain"],"champions_ganadas_temporadas":["2014-15","2024-25"],"subcampeon_temporadas":[],"finalista_temporadas":["2014-15","2024-25"],"estilo_tags":["bloque agresivo sin balon","libertad ofensiva","rotaciones"],"aprox":true},"texto_index":"CATEGORIA: coach\nENTRENADOR: Luis Enrique\nALIAS_BUSQUEDA: luis enrique\nDATOS_CLAVE: partidos~=60 | W=35 | D=12 | L=13 | UCL_titulos=2 | UCL_temporadas=2014-15, 2024-25\nCLUBES: Barcelona | Paris Saint Germain\nCLAVES: entrenador | tecnico | mister | champions | ucl\n","texto":"Luis Enrique ha tenido dos etapas especialmente exitosas en la Champions League segun este dataset. En total se le atribuyen unos 60 partidos dirigidos en la competicion, principalmente con Barcelona y Paris Saint Germain, con 35 victorias, 12 empates y 13 derrotas. Con el Barcelona gano la Champions en la temporada 2014-15, guiando al tridente Messi-Suarez-Neymar hacia un triplete historico. Años mas tarde, al frente del Paris Saint Germain, conquisto la Champions en la temporada 2024-25, con una goleada muy contundente en la final. En resumen, Luis Enrique ha ganado dos Champions League como entrenador: la de 2014-15 con el Barcelona y la de 2024-25 con el Paris Saint Germain. Su estilo mezcla un bloque agresivo sin balon con mucha libertad para los atacantes y un uso intenso de las rotaciones."}
